10;Номер паспорта: 1111-111111, Место и дата выдачи: Пут 20.09.1999, ФИО: Пан Ад Гад, Дата рождения: 10.10.1999
296;Номер паспорта: 1234-123456, Место и дата выдачи: Пан 20.12.2004, ФИО: Пан Андр Вик, Дата рождения: 20.07.2004
296;Номер паспорта: 1243-123456, Место и дата выдачи: Гал 20.10.1999, ФИО: Гал Пал Дал, Дата рождения: 09.09.2000
297;Номер паспорта: 2134-213456, Место и дата выдачи: Питер 04.02.1989, ФИО: Панченко Андрей Викторович, Дата рождения: 20.07.2004
298;Номер паспорта: 2234-222233, Место и дата выдачи: Лока 20.05.2005, ФИО: Нас Уар Кйн, Дата рождения: 07.04.2000
300;Номер паспорта: 1235-435678, Место и дата выдачи: Уфа 19.02.2007, ФИО: Уга Буга Туга, Дата рождения: 20.04.2004
301;Номер паспорта: 4321-654321, Место и дата выдачи: Рыбница 03.01.2009, ФИО: Анасасия Панченко Викторовна, Дата рождения: 20.07.2004
